{
  "id": "ssv-polymer-ps-001",
  "version": 1,
  "parent_ssv_id": null,
  "d": {
    "raw_data_id": "raw-data-gc-ms-001",
    "acquisition_timestamp": "2026-04-01T09:00:00Z",
    "signal_metadata": {
      "units": "m/z",
      "dynamic_range": { "min": 0, "max": 500 },
      "instrument_id": "GC-MS-001",
      "sample_id": "PS-styrene-001"
    }
  },
  "i": {
    "instrument_id": "GC-MS-001",
    "measurement_mode": "scan",
    "resolution": { "mass_resolution": 0.1 },
    "dynamic_range": { "min": 0, "max": 500 },
    "detector_type": "quadrupole",
    "calibration_state": { "last_calibrated": "2026-03-15T00:00:00Z" }
  },
  "a": [
    {
      "assumption_id": "a-01",
      "description": "Linear baseline assumption for KMD normalization",
      "type": "background_model",
      "domain": "polymer"
    },
    {
      "assumption_id": "a-02",
      "description": "Styrene fragment at m/z 104 is reference for KMD calculation",
      "type": "signal_model",
      "domain": "polymer"
    }
  ],
  "t": [
    {
      "step_id": 1,
      "operation": "baseline_removal",
      "parameters": { "method": "rolling_ball", "window": 50 },
      "software": "scientificstate-polymer",
      "software_version": "0.1.0"
    },
    {
      "step_id": 2,
      "operation": "kmd_normalization",
      "parameters": { "reference_unit": "CH2", "reference_mass": 104 },
      "software": "scientificstate-polymer",
      "software_version": "0.1.0"
    }
  ],
  "r": {
    "status": "derived",
    "quantities": [
      {
        "name": "kmd_clusters",
        "value": 5,
        "unit": "count"
      },
      {
        "name": "dominant_fragment",
        "value": 104,
        "unit": "m/z"
      }
    ],
    "classifications": [
      { "label": "polystyrene", "confidence": 0.92 }
    ]
  },
  "u": {
    "status": "quantified",
    "measurement_uncertainty": { "noise_floor_pct": 2.5 },
    "propagated_uncertainty": { "kmd_cluster_count_pct": 8.0 },
    "confidence_intervals": [
      { "quantity": "kmd_clusters", "lower": 4, "upper": 6, "level": 0.95 }
    ],
    "systematic_bias": { "detector_nonlinearity_pct": 1.2 }
  },
  "v": {
    "status": "valid",
    "valid_signal_range": { "snr_threshold": 3.0 },
    "assumption_applicability": "Valid for GC-MS data acquired under standard atmospheric conditions",
    "model_breakdown_conditions": [
      "Signal-to-noise ratio below 3.0",
      "Mass range outside 50-500 m/z"
    ]
  },
  "p": {
    "user_id": "researcher-001",
    "created_at": "2026-04-01T10:30:00Z",
    "parent_ssv_id": null,
    "software_stack": [
      { "name": "scientificstate-framework", "version": "0.1.0" },
      { "name": "scientificstate-polymer", "version": "0.1.0" },
      { "name": "python", "version": "3.12.0" }
    ],
    "execution_witness": {
      "compute_class": "classical",
      "backend_id": "local-python-cpu"
    }
  }
}
